{
  "query": {
    "text": "退款超过 30 天如何处理？",
    "locale": "zh-CN"
  },
  "mode": "hybrid",
  "spaces": ["https://knowledge.example/spaces/support"],
  "filters": {
    "assetTypes": ["procedure"],
    "validAt": "2026-07-15T02:00:00Z",
    "channels": ["published"]
  },
  "purpose": "customer-support",
  "supportedObligations": ["cite", "no-train"],
  "limit": 10,
  "include": ["summary", "passages", "attestations"],
  "extensions": {},
  "critical": []
}
